{
  "$schema": "https://json-schema.org/draft/2020-12/schema",
  "type": "object",
  "properties": {
    "id": {"type": "integer"},
    "name": {"type": "string"},
    "age": {"type": "integer", "minimum": 18},
    "email": {"type": "string", "format": "email"},
    "skills": {
      "type": "array",
      "items": {"type": "string"}
    },
    "address": {
      "type": "object",
      "items": {"type": "string"}
    }
  },
  "required": ["id", "name", "email"]
}
